[
  {
    "id": "cocktail_001",
    "name": "ZOMBIE",
    "glass": [
      "Highball",
      "Tiki Mug"
    ],
    "ice": "Crushed",
    "method": "Shake & Strain",
    "ingredients": [
      {
        "name": "Aromatic Bitters",
        "amount": 4,
        "unit": "dash"
      },
      {
        "name": "Absinthe",
        "amount": 2,
        "unit": "dash"
      },
      {
        "name": "Overproof Rum",
        "amount": 10,
        "unit": "ml"
      },
      {
        "name": "Grenadine",
        "amount": 10,
        "unit": "ml"
      },
      {
        "name": "Dark Rum",
        "amount": 20,
        "unit": "ml"
      },
      {
        "name": "Light Rum",
        "amount": 20,
        "unit": "ml"
      },
      {
        "name": "Fresh Lime Juice",
        "amount": 20,
        "unit": "ml"
      },
      {
        "name": "Cinnamon Syrup",
        "amount": 20,
        "unit": "ml"
      },
      {
        "name": "Grapefruit Juice",
        "amount": 20,
        "unit": "ml"
      }
    ],
    "garnish": [
      "Mint Sprig"
    ],
    "optionalNotes": "Add flaming lime boat with Wray & Nephew Overproof",
    "tastingNotes": null
  },
  {
    "id": "cocktail_002",
    "name": "PI\u00d1A COLADA",
    "glass": [
      "Highball",
      "Hurricane"
    ],
    "ice": "Cubed",
    "method": "Shake & Strain",
    "ingredients": [
      {
        "name": "Light Rum",
        "amount": 40,
        "unit": "ml"
      },
      {
        "name": "Coconut Liqueur",
        "amount": 20,
        "unit": "ml"
      },
      {
        "name": "Fresh Lime Juice",
        "amount": 10,
        "unit": "ml"
      },
      {
        "name": "Pineapple Juice",
        "amount": 60,
        "unit": "ml"
      },
      {
        "name": "Coco Re'al Coconut Cream",
        "amount": 40,
        "unit": "ml"
      }
    ],
    "garnish": [
      "Pineapple Wedge",
      "Cherry"
    ],
    "optionalNotes": null,
    "tastingNotes": null
  },
  {
    "id": "cocktail_003",
    "name": "LEMON DROP",
    "glass": [
      "Shooter"
    ],
    "ice": "None",
    "method": "Shake & Fine Strain",
    "ingredients": [
      {
        "name": "Vodka",
        "amount": 20,
        "unit": "ml"
      },
      {
        "name": "Fresh Lemon Juice",
        "amount": 10,
        "unit": "ml"
      },
      {
        "name": "Sugar Syrup",
        "amount": 10,
        "unit": "ml"
      }
    ],
    "garnish": [
      "Sugar coated lemon wedge"
    ],
    "optionalNotes": null,
    "tastingNotes": null
  }
]